{
  "benchmark_id": "declared_objective_gradient",
  "benchmark_version": "0.3",
  "configuration": {
    "attachment_type": "current",
    "control_points": 9,
    "flow_integrator": "deformetrica_heun",
    "gradient_block": "momenta",
    "pairwise_evaluation": {
      "mode": "blockwise",
      "query_tile_size": 64,
      "source_tile_size": 64
    },
    "process_isolation": "fresh multiprocessing spawn process per repeat",
    "random_seed": 20260715,
    "repeats": 5,
    "rss_sampling_interval_ms": 5.0,
    "shooting_integrator": "rk2",
    "threads": 1,
    "tile_autograd_strategy": "recompute",
    "timepoints": 5,
    "warmup_evaluations_per_repeat": 1
  },
  "created_at": "2026-07-22T16:46:54+00:00",
  "environment": {
    "diffeoforge": "0.0.0.dev0",
    "logical_cpus": 32,
    "numpy": "2.5.1",
    "parent_executable": "python.exe",
    "physical_memory_bytes": 136522924032,
    "platform": "Windows-11-10.0.26200-SP0",
    "psutil": "7.2.2",
    "python": "3.12.13",
    "pytorch": "2.13.0+cpu"
  },
  "input": {
    "available_subject_count": 5,
    "selected_subject_count": 5,
    "selection": "first subjects in validated deterministic path order",
    "subjects": [
      {
        "bytes": 10026,
        "label": "subject-01.vtk",
        "points": 162,
        "role": "subject",
        "sha256": "25c07a447699028e63b535c00ca094803664fcda15595c1645d9cb3a5b73233b",
        "triangles": 320
      },
      {
        "bytes": 10024,
        "label": "subject-02.vtk",
        "points": 162,
        "role": "subject",
        "sha256": "932d282639be32a04f127f86ba67bb9b2d7559a849a0169f7e87e668dbec9cc2",
        "triangles": 320
      },
      {
        "bytes": 10038,
        "label": "subject-03.vtk",
        "points": 162,
        "role": "subject",
        "sha256": "87503b00d72e5700619a3c46a9dca185f42e5be8b362de7087b3d9b97a9a8486",
        "triangles": 320
      },
      {
        "bytes": 10026,
        "label": "subject-04.vtk",
        "points": 162,
        "role": "subject",
        "sha256": "b69329d0832bd5a0ec90827cd3d0f90dc6e8b30adb3239eb6b2131b09163e848",
        "triangles": 320
      },
      {
        "bytes": 10030,
        "label": "subject-05.vtk",
        "points": 162,
        "role": "subject",
        "sha256": "0703116ec14196cb1d2737ccbc1467a170404101ae6749e8a1867bf44030c325",
        "triangles": 320
      }
    ],
    "template": {
      "bytes": 10021,
      "label": "template.vtk",
      "points": 162,
      "role": "template",
      "sha256": "e3f5fa71028d419e28e07403af2eff932d6e950acce9a989e1f1a2cc441b8325",
      "triangles": 320
    }
  },
  "numerical_consistency": {
    "absolute_tolerance": 1e-12,
    "consistent": true,
    "gradient_norm_maximum": 233.04817682643994,
    "gradient_norm_minimum": 233.04817682643994,
    "gradient_norm_span": 0.0,
    "objective_maximum": -44.071389216721535,
    "objective_minimum": -44.071389216721535,
    "objective_span": 0.0,
    "relative_tolerance": 1e-12
  },
  "operation_model": {
    "gaussian_calls_per_evaluation": 200,
    "gaussian_pair_elements_per_evaluation": 1606065,
    "largest_execution_tile": {
      "float64_matrix_bytes": 32768,
      "float64_xyz_difference_tensor_bytes": 98304,
      "logical_columns": 320,
      "logical_rows": 320,
      "operation": "template_attachment_self",
      "pair_elements": 4096,
      "subject_label": null,
      "tile_columns": 64,
      "tile_rows": 64
    },
    "largest_logical_pair": {
      "columns": 320,
      "float64_matrix_bytes": 819200,
      "float64_xyz_difference_tensor_bytes": 2457600,
      "operation": "template_attachment_self",
      "pair_elements": 102400,
      "rows": 320,
      "subject_label": null
    }
  },
  "samples": [
    {
      "gradient_norm": 233.04817682643994,
      "objective": -44.071389216721535,
      "repeat": 1,
      "rss_before_bytes": 302526464,
      "rss_sample_count": 24,
      "sampled_peak_rss_bytes": 303554560,
      "sampled_rss_delta_bytes": 1028096,
      "wall_time_ns": 350944200
    },
    {
      "gradient_norm": 233.04817682643994,
      "objective": -44.071389216721535,
      "repeat": 2,
      "rss_before_bytes": 302526464,
      "rss_sample_count": 19,
      "sampled_peak_rss_bytes": 303185920,
      "sampled_rss_delta_bytes": 659456,
      "wall_time_ns": 279933100
    },
    {
      "gradient_norm": 233.04817682643994,
      "objective": -44.071389216721535,
      "repeat": 3,
      "rss_before_bytes": 302186496,
      "rss_sample_count": 20,
      "sampled_peak_rss_bytes": 302862336,
      "sampled_rss_delta_bytes": 675840,
      "wall_time_ns": 285244900
    },
    {
      "gradient_norm": 233.04817682643994,
      "objective": -44.071389216721535,
      "repeat": 4,
      "rss_before_bytes": 301895680,
      "rss_sample_count": 20,
      "sampled_peak_rss_bytes": 302735360,
      "sampled_rss_delta_bytes": 839680,
      "wall_time_ns": 289645600
    },
    {
      "gradient_norm": 233.04817682643994,
      "objective": -44.071389216721535,
      "repeat": 5,
      "rss_before_bytes": 301924352,
      "rss_sample_count": 20,
      "sampled_peak_rss_bytes": 302817280,
      "sampled_rss_delta_bytes": 892928,
      "wall_time_ns": 290024900
    }
  ],
  "scientific_boundary": "Fresh CPU processes measure one explicitly declared exact objective plus gradient for the first configured optimizer block. Wall time excludes tensor/input preparation and warm-up. Process RSS is sampled every 5 ms after warm-up and can miss shorter peaks; it is not total system memory, GPU memory, full-optimizer peak RAM, end-to-end workflow runtime, an ETA model, an extrapolation to 300 subjects, or a hardware pass/fail verdict.",
  "source_config": {
    "filename": "minimal-modern-atlas-blockwise.yaml",
    "project": "synthetic-modern-atlas-blockwise",
    "sha256": "80484b95e4ed113752372df7e8597e9049c7e16133f3d8fd8b35ceb8e8b3472a"
  },
  "summary": {
    "rss_before_bytes": {
      "maximum": 302526464,
      "median": 302186496,
      "minimum": 301895680
    },
    "sampled_peak_rss_bytes": {
      "maximum": 303554560,
      "median": 302862336,
      "minimum": 302735360
    },
    "sampled_rss_delta_bytes": {
      "maximum": 1028096,
      "median": 839680,
      "minimum": 659456
    },
    "wall_time_ns": {
      "maximum": 350944200,
      "median": 289645600,
      "minimum": 279933100
    }
  },
  "warnings": [
    "Sampled process RSS can miss peaks shorter than the 5 ms sampling interval.",
    "This measures one objective+gradient evaluation, not a full optimizer or workflow.",
    "Do not extrapolate these repeats to 300 subjects without a prospective scaling design.",
    "Recompute trades additional backward calculation for a different saved-tensor graph."
  ]
}
